,Description,Category,SubCategory1,SubCategory2,SubCategory3
1296,"In Binckhorstlaan 271 large pallets with boxes and rotting food. Report made previously not taken up. Great nuisance flies, smell and now rats. Yeast on the ground. Environment with children. Please remove this as soon as possible. MOR2176874 Mister can also be reached on 0707523411 or 0647420451",Waste,Bulky waste,Construction and demolition waste,
1297,"Customer indicates that debris, wood, 6 full plastic bags, rocks and a cement bin have been left in front of her door. ",Waste,Bulky waste,Construction and demolition waste,
1298,Construction waste has been on the sidewalk for several days,Waste,Bulky waste,Construction and demolition waste,
1299,Mrs. indicates that there is debris and glass on the parking space.,Waste,Bulky waste,Construction and demolition waste,
1300,"paint pot, leaked ",Waste,Bulky waste,Construction and demolition waste,
1301,Debris on sidewalk ,Waste,Bulky waste,Construction and demolition waste,
1302,Bulky waste wooden beams see photo ,Waste,Bulky waste,Construction and demolition waste,
1303,Sink and toilet bowl next to orac.,Waste,Bulky waste,Construction and demolition waste,
1304,There's a gas bottle here.,Waste,Bulky waste,Construction and demolition waste,
1305,There are 2 containers for construction and demolition waste that are bulging with waste.,Waste,Bulky waste,Construction and demolition waste,
1306,toilet and two yellow garbage bags with debris,Waste,Bulky waste,Construction and demolition waste,
1307,Various debris on sidewalk Please remove. Thank you ,Waste,Bulky waste,Construction and demolition waste,
1308,"construction waste is there sl 5 days and comes from no. 109, they are renovating.",Waste,Bulky waste,Construction and demolition waste,
1309,Please remove debris Thank you,Waste,Bulky waste,Construction and demolition waste,
1310,Stones among the green.,Waste,Bulky waste,Construction and demolition waste,
1311,A door to a clean wojk has been against the tree for days and belongs to number 152. Please have this removed. Laakkwartier is a Ghetto in Wording. Romnel and nothing but Romnel. Thank you.,Waste,Bulky waste,Construction and demolition waste,
1312,"It concerns tiles and stones that have been there for months (see photo), please remove. The reporter indicates that he has already communicated this.",Waste,Bulky waste,Construction and demolition waste,
1313,Rubbish at orac plate is broken too.,Waste,Bulky waste,Construction and demolition waste,
1314,"These tiles have been there for months, can they be removed?",Waste,Bulky waste,Construction and demolition waste,
1315,On the Capadosestraat at nr 104 there is a car tire (and a mattress) next to a construction container. Can this be cleaned up?,Waste,Bulky waste,Construction and demolition waste,
1316,pallets in a parking lot ,Waste,Bulky waste,Construction and demolition waste,
1317,"Via BB: ""Please remove debris, among others. Hoek Bontekoekade / Bontekoestraat See photo Thank you"" "" ",Waste,Bulky waste,Construction and demolition waste,
1318,"Following the previous report MOR2286982, the bulky waste and construction waste has still not been cleaned up. Can this be dealt with urgently? office chairs, cupboards, toilet bowls, etc. a large pile of bulky waste next to a dumpster, and everything is now scattered through the street. and people keep adding stuff to it even from the 3rd floor. can this be cleaned up asap?",Waste,Bulky waste,Construction and demolition waste,
1319,"Construction and demolition waste is on the sidewalk, it concerns stones and a stone slab. ",Waste,Bulky waste,Construction and demolition waste,
1320,"Ms. had an appointment today for bulky waste. That has also been picked up. Someone added a toilet bowl and it was not taken. Can it still be picked up, mrs does not want to have any problems with this.",Waste,Bulky waste,Construction and demolition waste,
1321,"bulky waste such as toilet pots, iron items and more",Waste,Bulky waste,Construction and demolition waste,
1322,Christmas tree and roofing,Waste,Bulky waste,Construction and demolition waste,
1323,This involves approx. 12 bags of debris,Waste,Bulky waste,Construction and demolition waste,
1324,The reporter indicates that employees of a company are busy renovating a home. They have the construction and demolition waste in mrs. stopped her wheelie bin and refused to take it out. Can the wheelie bin be emptied? Madam cannot now hand over her household waste,Waste,Bulky waste,Construction and demolition waste,
1325,BuitenBeter notification number: 8269508. Construction / demolition waste on the street (see photo),Waste,Bulky waste,Construction and demolition waste,
1326,Stone on the lawn.,Waste,Bulky waste,Construction and demolition waste,
1327,Waste dump of radiator and sink by gray Toyota van with vdz-24-r Monday 6 July 7:30 am with shameless name and number being averdieck maintenance company 0614100792 Please maintain Greeting karel 0643091664.,Waste,Bulky waste,Construction and demolition waste,
1328,Mr. van Handhaving indicates that a pallet with demolition waste and a refrigerator has been dumped. The request to remove this as soon as possible due to fire sensitivity.,Waste,Bulky waste,Construction and demolition waste,
1329,Mrs. saw someone drop bags at the ORAC. Turns out there is all construction waste in it. She noted the registration number of the car that did so. Please remove and maintain. Registration number: VV-782-3,Waste,Bulky waste,Construction and demolition waste,
1330,Apparently the new Bulgarian owners think this is normal! Just throw them on the street.,Waste,Bulky waste,Construction and demolition waste,
1331,Pallets next to the trash can,Waste,Bulky waste,Construction and demolition waste,
1332,approx 50m2. Construction and demolition waste. would come from Lyonnetstraat 11e.,Waste,Bulky waste,Construction and demolition waste,
1333,Great dirt. Wood. Broken toilet bowl (has been here for weeks and previously reported).,Waste,Bulky waste,Construction and demolition waste,
1334,"Via BB: ""This concerns large pieces of combustible construction waste at The Hague University of Applied Sciences. Exact location is"" watercourse "". This must be removed before the turn of the year!""",Waste,Bulky waste,Construction and demolition waste,
1335,more than 6 car tires ,Waste,Bulky waste,Construction and demolition waste,
1336,"Last Monday, the gentleman already reported about 12 bags of rubble that have been put on the street, MOR2278789. Mister indicates that it has not yet been removed and that only more bulky waste has been added. The kind request to come and take it away.",Waste,Bulky waste,Construction and demolition waste,
1337,"The reporter had an appointment for flammable stuff for today. Her bulky waste was neatly collected, but local residents had added things that have now been left behind, it is debris and demolition waste (bathroom tiles, cupboard with marble plate on it and paint, among other things). Please delete.",Waste,Bulky waste,Construction and demolition waste,
1338,A cement package has been on the street for 3 weeks.,Waste,Bulky waste,Construction and demolition waste,
1339,"small / large stones along tram track diagonally opposite lamppost 17, at bus stop 26 in the direction of voorburg, moorwijk station.",Waste,Bulky waste,Construction and demolition waste,
1340,Bulky waste debris gravel tiles,Waste,Bulky waste,Construction and demolition waste,
1341,"Via BB: ""A mountain of wood and a bag of sand roof plates. This will go on for a while. Since a sea container has been standing there for a year""",Waste,Bulky waste,Construction and demolition waste,
1342,"Via BB. Large iron jugs, see photo",Waste,Bulky waste,Construction and demolition waste,
1343,"There is a lot of furniture on the street. Residents who no longer live there have posted this. Former residents of house number 553. there is construction and demolition waste, mattresses, cupboards, etc. It is a lot.",Waste,Bulky waste,Construction and demolition waste,
1344,"Paint stuff, tin brushes, telescopic arms and plastic remains Goeverneurlaan 99 Den Haag The Hague Saturday, 31 October 2020 10:58 ",Waste,Bulky waste,Construction and demolition waste,
1345,street tiles are placed on the street,Waste,Bulky waste,Construction and demolition waste,
1346,Bulky waste and gravel tiles,Waste,Bulky waste,Construction and demolition waste,
1347,"Via BB: ""Bulky waste, see photo (toilet + radiator)""",Waste,Bulky waste,Construction and demolition waste,
1348,Been here for a year,Waste,Bulky waste,Construction and demolition waste,
1349,"How many more notifications should I make before ALL of this is gone ......?!?! I have already devoted 6 reports to this stuff, I think and somehow it remains. That's weird, isn't it?",Waste,Bulky waste,Construction and demolition waste,
1350,"Reported so often, this has been there for months",Waste,Bulky waste,Construction and demolition waste,
1351,Do not know. But what is this. Mountains of sand and soil. You can't tell me this hasn't been seen by enforcement. Here we go again. How come this is a deprived neighborhood. Well maybe. This kind of things,Waste,Bulky waste,Construction and demolition waste,
1352,"There is a lot of sand and stones on the road, can it be removed?",Waste,Bulky waste,Construction and demolition waste,
1353,Sacks of construction size filled with sand and dumped in parking lots last August. It is still happy to remove it asap,Waste,Bulky waste,Construction and demolition waste,
1354,Sacks with construction waste dumped,Waste,Bulky waste,Construction and demolition waste,
1355,"These cones have been in the street for a week. In different positions, because nobody knows why they are there and they take up parking space. There is a good chance that they will be in a ditch next week ... unfortunately that would not be the first time.",Waste,Bulky waste,Construction and demolition waste,
1356,bulky waste / cupboards,Waste,Bulky waste,Construction and demolition waste,
1357,Bulky waste has been there for a few weeks,Waste,Bulky waste,Construction and demolition waste,
1358,Concrete next to oracs ,Waste,Bulky waste,Construction and demolition waste,
1359,Please take pallets left at the container with you,Waste,Bulky waste,Construction and demolition waste,
1360,There is an increase from yesterday in front of Mrs. Mrs. had asked the neighbors and the neighbors don't know anything about it. Mrs. lives on the third floor.,Waste,Bulky waste,Construction and demolition waste,
1361,"Around the corner from Multatulistraat - Alberdink Tijmstraat is white paint on the street. Dumped by this resident Mrs., Me JANGA ALBERDINK TIJMSTRAAT 106 2524 HN THE HAGUE",Waste,Chemical waste,Paint on the street,
1362,In Linneausstraat there is a bag of spray lime on the street at number 119.,Waste,Bulky waste,Construction and demolition waste,
1363,Bags of soil at least 30 bags,Waste,Bulky waste,Construction and demolition waste,
1364,Dumped soil may have come from a hemp farm,Waste,Bulky waste,Construction and demolition waste,
1365,In the Van Zeggelenlaan at number 125 there is construction and demolition waste on the street. This probably comes from the containers that are used there for the renovations. Can this be cleaned up?,Waste,Bulky waste,Construction and demolition waste,
1366,glass on the street ... can also possibly damage a bit if they want to harm,Waste,Bulky waste,Construction and demolition waste,
1367,"On the Allard Piersonlaan at the Jan ten Brinkstraat, on the sidewalk of the intersection between A piersonlaan and the J ten Brinkstraat at house numbers 147 145 near the portico. Corrugated sheet approx. 0.50 by 1 meter. See report number MOR1990708. This concerns the third report. There is a fear that there is asbestos, many people / children come along and children stand on it. Please take it seriously and remove it urgently",Waste,Bulky waste,Construction and demolition waste,
1368,Mr. reports that a corrugated iron with probably asbestos in it is on the public road. Could it be delete? Please pick it up urgently.,Waste,Bulky waste,Construction and demolition waste,
1369,Mrs. indicates that there is asbestos on the sidewalk. Mrs. suspect that a roof covering has been blown off somewhere. She requests the municipality to remove this immediately.,Waste,Bulky waste,Construction and demolition waste,
1370,There is construction waste on the sidewalk.,Waste,Bulky waste,Construction and demolition waste,
1371,Someone dumped them as rubble,Waste,Bulky waste,Construction and demolition waste,
1372,Debris waste dumped on the street.,Waste,Bulky waste,Construction and demolition waste,
1373,Can construction and demolition waste on public roads be removed?,Waste,Bulky waste,Construction and demolition waste,
1374,"Construction waste (bags with stone, etc.) at the bench on the sidewalk.",Waste,Bulky waste,Construction and demolition waste,
1375,3rd report (has been there for a month) stones dumped by a car from the neighborhood. Stones are located at the rear next to the above-ground containers that are emptied at least twice a week and are seen by HMS employees. But don't get cleaned up. This is the 3rd report on this. They also do not contact me to ask how or what !!!! Location of stones: next to the above-ground containers. Rear red cross building,Waste,Bulky waste,Construction and demolition waste,
1376,Sir indicates that there is half a dormer window in the green. ,Waste,Bulky waste,Construction and demolition waste,
1377,Sir indicates that there are 12 stones scattered behind the bushes in the lawn. And against the bushes is a cement bucket and debris by the tree.,Waste,Bulky waste,Construction and demolition waste,
1378,Mrs. indicates that there is bulky waste and construction waste at the rear. Lots of junk. This has been there for a while. Can this be removed urgently?,Waste,Bulky waste,Construction and demolition waste,
1379,"For a week now, there has been waste in front of the porch, it is a radiator, stones, wood, boxes and debris in bags.",Waste,Bulky waste,Construction and demolition waste,
1380,7 bags of construction waste and debris. Please delete,Waste,Bulky waste,Construction and demolition waste,
1381,"Complaint reports this for the third time. More and more is being deposited. Comes off the porch. Please take quick action now, think this is scandalous.",Waste,Bulky waste,Construction and demolition waste,
1382,2 barrels of fire on the sidewalk. ,Waste,Bulky waste,Construction and demolition waste,
1383,Tiles and a broken sink.,Waste,Bulky waste,Construction and demolition waste,
1384,"Since last Thursday there is some construction waste (tiles, sink). ",Waste,Bulky waste,Construction and demolition waste,
1385,Stones dumped next to garbage containers.,Waste,Bulky waste,Construction and demolition waste,
1386,Bulky waste on public roads. Near the high-voltage space of Stedin E107 house number 98.,Waste,Bulky waste,Construction and demolition waste,
1387,The customer says that they are now on the neherkade. A number of plaster plates have fallen into the tunnel. Would you like to clear this up as soon as possible?,Waste,Bulky waste,Construction and demolition waste,
1388,"Since Monday morning, metal plates and mesh have been placed at the intersection of Allard Piersonlaan at 262. I waited until today if it was reported but no. Leo Noordermeer",Waste,Bulky waste,Construction and demolition waste,
1389,"Mr. indicates that there were works in the street that have now been completed, but a lot of sand has been left behind, which causes nuisance in the street. Older people are afraid that the virus will move in the sand? Please send a road sweeper.",Waste,Bulky waste,Construction and demolition waste,
1390,There is a shopping cart with paint pots in the street. There has also been a report but nothing has been done about it. There is also paint everywhere now. MOR2088726,Waste,Bulky waste,Construction and demolition waste,
1391,"Opposite the entrance of Laakkwartier football club, construction and demolition waste has been dumped. There is wood and various garbage bags",Waste,Bulky waste,Construction and demolition waste,
1392,"There is construction waste, chemical waste and bulky waste ",Waste,Bulky waste,Construction and demolition waste,
1393,Debris bags with construction waste. about 7 bags at the ORAC,Waste,Bulky waste,Construction and demolition waste,
1394,"Neighbors made an appointment, but Gips was not picked up.",Waste,Bulky waste,Construction and demolition waste,
1395,"Construction and demolition waste left behind was previously reported MOR2046486, however, has not been removed. There were also many stones in front of which were for the street that is being renovated. The stones are now gone, so that the construction waste is clearly visible. Construction and demolition waste has been dumped opposite the entrance of football club Laakkwartier. There is wood and various garbage bags",Waste,Bulky waste,Construction and demolition waste,
1396,There are 5 garbage bags with sand on the sidewalk where the wheelie bin collection is.,Waste,Bulky waste,Construction and demolition waste,
1397,Construction and demolition waste dumped.,Waste,Bulky waste,Construction and demolition waste,
1398,Sacks of construction debris on the street,Waste,Bulky waste,Construction and demolition waste,
1399,"The gentleman indicates that a bulky waste appointment was made yesterday, but they still left the tiles, green waste bin, etc. ",Waste,Bulky waste,Construction and demolition waste,
1400,The detector indicates that there is rubble in the street. Young people play with the bulky waste so that it is spread in the street.,Waste,Bulky waste,Construction and demolition waste,
1401,There is a lot of wood for the garage. Been there for a while. Why isn't this removed by the owner? Soon someone will set it on fire.,Waste,Bulky waste,Construction and demolition waste,
1402,"Madam had made a bulky waste appointment. Local residents have placed tiles here, these are still here",Waste,Bulky waste,Construction and demolition waste,
1403,Garbage bags with soil (?) On the sidewalk,Waste,Bulky waste,Construction and demolition waste,
1404,There is construction and demolition waste in the street. At the playground. It is a concrete fireplace. Waste is from 45 or 47.,Waste,Bulky waste,Construction and demolition waste,
1405,"Sir says that in the past a mountain of sand was dumped by someone, in the park and this has not been removed by the municipality, plants have started to grow through it, but recently people also dumped earth in it again, and also hammered a pole in it, this looks very untidy and the plants will also die. do you want to clear this up? both the sand and the earth.",Waste,Bulky waste,Construction and demolition waste,
1406,On the sidewalk there are stones (Klinkers) in a heap.,Waste,Bulky waste,Construction and demolition waste,
1407,"There are stones at the oracs, a report was made about this last Monday and stones have been removed, but not everything. see mor2078970",Waste,Bulky waste,Construction and demolition waste,
1408,"Mister had a bulky waste appointment and his bulky waste has been taken, but someone has put a pot of paint there. Sir doesn't want to get into trouble because of this, because it's not his. Please take away",Waste,Bulky waste,Construction and demolition waste,
1409,"Ms indicates that someone has placed stones next to the containers. There has already been damage, because someone from the neighborhood smashed a window with those stones.",Waste,Bulky waste,Construction and demolition waste,
1410,Seems like an empty gas bottle. A strange place along the way.,Waste,Bulky waste,Construction and demolition waste,
1411,"The reporter indicates that there is a dryer and street tiles on the street, please remove them.",Waste,Bulky waste,Construction and demolition waste,
1412,There are drainage pipes next to the car tunnel under the Veenweg. These have been around for quite some time.,Waste,Bulky waste,Construction and demolition waste,
1413,For a month now there have been 50x50 terrace tiles against a shed. ,Waste,Bulky waste,Construction and demolition waste,
1414,There has been a toilet bowl there for a week and it doesn't belong to anyone. Please take away.,Waste,Bulky waste,Construction and demolition waste,
1415,There are concrete blocks at Weidevogellaan 225 ,Waste,Bulky waste,Construction and demolition waste,
1416,"There is illegally dumped waste. Bags, refrigerator, trunk of tree and ground.",Waste,Bulky waste,Construction and demolition waste,
1417,SUEZ container is on public roads. Stones are taken out by children. The reporter is afraid that it will be thrown.,Waste,Bulky waste,Construction and demolition waste,
1418,"At the beginning of January 2020 there was a garden company that tiled someone's garden! Then left with the necessary articles left behind in the parking lot. There have now been a number of pallets and garden tiles in the parking lot (between numbers 20 and 22) for 4 weeks ... nothing happens! It is in a parking space .... it cannot be used! This message is also indicated on 11-2. MOR 1989970 status is completed, however, the customer indicates that nothing has been cleaned up yet.",Waste,Bulky waste,Construction and demolition waste,
1419,"Illegally dumped construction waste behind the containers in the grass, along the fence.",Waste,Bulky waste,Construction and demolition waste,
1420,At the beginning of January 2020 there was a garden company that tiled someone's garden! Then left with the necessary articles left behind in the parking lot. There have now been a number of pallets and garden tiles in the parking lot (between numbers 20 and 22) for 4 weeks ... nothing happens! It is in a parking space .... it cannot be used!,Waste,Bulky waste,Construction and demolition waste,
1421,"There is construction and demolition waste on the road. Most of it is in pockets. There is also something loose, sir indicates that there are paint cans loose.",Waste,Bulky waste,Construction and demolition waste,
1422,"There is a container belonging to the company VGS Gevelwerken at laan van Waalhaven 107 (opposite DHL). A report of bulky waste (couch) has previously been made and this has been collected, but the doors and racks are still there. Can these be collected?",Waste,Bulky waste,Construction and demolition waste,
1423,Has been like this since before Christmas. Children play and throw tiles. Dangerous. Will it still be picked up?,Waste,Bulky waste,Construction and demolition waste,
1424,Paint cans stand next to a construction container. Please delete,Waste,Chemical waste,Paint on the street,
1425,There is a mountain of stones in the parking lot between Het ROC Mondriaan and the apartment complex. The request from ROC Mondriaan to remove the stones.,Waste,Bulky waste,Construction and demolition waste,
1426,"The resident has been bothered by the local residents for a while, those residents leave all bulky waste (large amount of waste) and place it against the resident's hedge, making maintenance impossible. Reports have been made more often, but local residents continue to take this action. At the moment there is also a large sand mountain and large sand against enneco house. And against the hedge of Faberlaan is a large awning. Please extra enforcers!",Waste,Bulky waste,Construction and demolition waste,
1427,"2 loose tiles + cardboard box. Are not off the sidewalk, just too much.",Waste,Bulky waste,Construction and demolition waste,
1428,"Construction waste is regularly dumped on the sidewalk, including this time paint cans on the sidewalk. It is a light gray van with registration number: 88-VTT-4. This happens at different times of the day. The paint cans were dumped around 5 in the morning.",Waste,Chemical waste,Paint on the street,
1429,"In the firebreak behind the house on Curtisslaan 4 is a huge load of garden soil and all kinds of pieces of wood, opposite the back of the houses Plesmanlaan 123 and 125. A report has already been made: MOR2212164",Waste,Bulky waste,Construction and demolition waste,
1430,Garden tiles have been there for months,Waste,Bulky waste,Construction and demolition waste,
1431,5 large construction bags with stones in them have been placed on the sidewalk.,Waste,Bulky waste,Construction and demolition waste,
1432,Stone waste in 2 places between the ehc entrance and VEO at the green zoom car park,Waste,Bulky waste,Construction and demolition waste,
1433,"2 huge pallets of stone, dumped on the sidewalk. Have been there for 2 weeks, please remove!",Waste,Bulky waste,Construction and demolition waste,
1434,Stone storage on the sidewalk behind path,Waste,Bulky waste,Construction and demolition waste,
1435,A lot of things will be built behind the Blauwe Reigersingel (near the barns). Lives dangerous when children / someone there cycling in darkness. Removing weeds is apparently also effort.,Waste,Bulky waste,Construction and demolition waste,
1436,Again dumped rubbish on the railway lane in front of the garage park. It will remain a dump here,Waste,Bulky waste,Construction and demolition waste,
1437,Mrs. had a bulky waste appointment yesterday. Someone else added a toilet bowl. and this one is still there. Please delete.,Waste,Bulky waste,Construction and demolition waste,
1438,"A pile of garden tiles has been standing in the parking lot on the Achterlijn between the sportsingel and the golf course for a few months now. The aso owner probably had them over and left them. There was also a container of the Fa Omega. It also stood there for a long time, but is now gone. Enforcement has already passed by. I don't know who owns the tiles.",Waste,Bulky waste,Construction and demolition waste,
