,Description,Category,SubCategory1,SubCategory2,SubCategory3
987,There are 8 car tires dumped here.,Waste,Chemical waste,Car tires,
988,there are car tires next to the oracs ,Waste,Chemical waste,Car tires,
989,there is a car tire next to the oracs ,Waste,Chemical waste,Car tires,
990,Brush rush opposite No. 2 at the underground container,Waste,Chemical waste,Car tires,
991,Car tire in bushes at school,Waste,Chemical waste,Car tires,
992,Bulky waste car tires,Waste,Chemical waste,Car tires,
993,There are 4 car tires on the public road. The resident thinks this is dangerous. Please remove this asap.,Waste,Chemical waste,Car tires,
994,Car tires next to orac.,Waste,Chemical waste,Car tires,
995,Car tire (bulky waste) next to ORAC.,Waste,Chemical waste,Car tires,
996,There are about 6 car tires Laan van poot towards the Houtrustweg,Waste,Chemical waste,Car tires,
997,All kinds of waste has been dumped at various places in the green area of ​​the municipality,Waste,Chemical waste,Car tires,
998,"Via BB: ""Car tires placed at orac""",Waste,Chemical waste,Car tires,
999,"Hello, I have reported this several times, and now I think someone has been from Stedin and put it behind the tree. It used to be in front of the Stedin door. But of course it did not open anymore. I hope the municipality will finally clear it up.",Waste,Chemical waste,Car tires,
1000,car tires on the street. HHT did not like to have this sorted out by anyone including a trolley.,Waste,Chemical waste,Car tires,
1001,there are some car tires on the street,Waste,Chemical waste,Car tires,
1002,"- Waste, I have reported this 2 times before, but it has not been removed, is dirt from the magnet fishing",Waste,Chemical waste,Car tires,
1003,Car tires on sidewalk Please remove them Thank you,Waste,Chemical waste,Car tires,
1004,Car tires at orac 10VO1530,Waste,Chemical waste,Car tires,
1005,Neighbor of Burgemeester Jansenstraat 1 has moved tires to another location. Continues to take out illegal waste. There are camera images,Waste,Chemical waste,Car tires,
1006,"Car tires spilled on the street, images of the perpetrator may be available. It may be a resident of this street.",Waste,Chemical waste,Car tires,
1007,Can residues that have fallen from a debris container be removed? ,Waste,Bulky waste,Construction and demolition waste,
1008,"There is a frame with broken glass in the bushes, next to the lawn. Very dangerous for children playing!",Waste,Bulky waste,Construction and demolition waste,
1009,"bulky waste already made, there is also construction and demolition waste",Waste,Bulky waste,Construction and demolition waste,
1010,The detector indicates that there are debris bags on the street with tiles. Please delete,Waste,Bulky waste,Construction and demolition waste,
1011,Second request dumping toilet. Still present.,Waste,Bulky waste,Construction and demolition waste,
1012,"A huge amount of bulky waste, construction and demolition waste dumped. Looks like a dump place. It has been there for a year and a half and is getting worse",Waste,Bulky waste,Construction and demolition waste,
1013,"Mister indicates that curbs have been dumped along the track at Willem Dreespark, on the side of the school for children who are difficult to educate. Can these be removed?",Waste,Bulky waste,Construction and demolition waste,
1014,Ms indicates that there are now two pallets on the sidewalk for about 4 weeks. Please pick up.,Waste,Bulky waste,Construction and demolition waste,
1015,Construction waste lies next to this porch,Waste,Bulky waste,Construction and demolition waste,
1016,Yes when placed with container 0240. WC Pot,Waste,Bulky waste,Construction and demolition waste,
1017,Construction waste from Loosduinsekade 249,Waste,Bulky waste,Construction and demolition waste,
1018,debris but also rest,Waste,Bulky waste,Construction and demolition waste,
1019,There are a lot of paving stones stacked on the road ,Waste,Bulky waste,Construction and demolition waste,
1020,Bag of tiles at orac,Waste,Bulky waste,Construction and demolition waste,
1021,On the Leyweg at the height of 1630 tiles have been dumped in the green. See picture.,Waste,Bulky waste,Construction and demolition waste,
1022,"Stack of wooden planks, see photo.",Waste,Bulky waste,Construction and demolition waste,
1023,"heavy plaster blocks on the street, see photo",Waste,Bulky waste,Construction and demolition waste,
1024,Police control room indicates that there is a large concrete block in the middle of the intersection. The request to remove this urgently.,Waste,Bulky waste,Construction and demolition waste,
1025,"There are planks, nails, tiles and laminate in the parking lot. Would you like to send someone over? This is extremely dangerous for motorists",Waste,Bulky waste,Construction and demolition waste,
1026,toilet not included neighbors with bulky waste appointment,Waste,Bulky waste,Construction and demolition waste,
1027,The detector indicates that there is bulky waste on the street. It is a toilet bowl. Please delete,Waste,Bulky waste,Construction and demolition waste,
1028,There is a whole pile of sand in a parking space. This has been left by people who have opened the street for work.,Waste,Bulky waste,Construction and demolition waste,
1029,Wooden planks etc. placed near the tree. See picture.,Waste,Bulky waste,Construction and demolition waste,
1030,At this address are mattresses and construction waste (rubble) at the orac's,Waste,Bulky waste,Construction and demolition waste,
1031,Concrete post and wooden planks next to oracs,Waste,Bulky waste,Construction and demolition waste,
1032,Mr. reports that fences and a container were left behind after the construction work. Could these be removed?,Waste,Bulky waste,Construction and demolition waste,
1033,These tiles have been on the sidewalk for 2 months now. They are new but arrived and apparently over.,Waste,Bulky waste,Construction and demolition waste,
1034,A toilet is on the side of the flat ,Waste,Bulky waste,Construction and demolition waste,
1035,Bulky waste: including marble floor tiles.,Waste,Bulky waste,Construction and demolition waste,
1036,Toilet bowl on the public road.,Waste,Bulky waste,Construction and demolition waste,
1037,WC Pot placed at an ORAC,Waste,Bulky waste,Construction and demolition waste,
1038,Shopping cart Aldi (which is not close at all ...) with stones and stones on the sidewalk.,Waste,Bulky waste,Construction and demolition waste,
1039,"polystyrene foam, plastic containers, cardboard",Waste,Bulky waste,Construction and demolition waste,
1040,A safe has been removed from the water at trem stop nieuwedamlaan and there is also a pipe and iron stop that can be removed,Waste,Bulky waste,Construction and demolition waste,
1041,VIA TWITTER SEE PHOTO ---------------------------------------------- -------------------------------------------------- ---------------------------------- This mess has been there for a while @GemeenteDenHaag. Between Zuidlarenstraat and Gasseltestraat. ,Waste,Bulky waste,Construction and demolition waste,
1042,Toilet bowl and tube with container 1435,Waste,Bulky waste,Construction and demolition waste,
1043,"toilet bowl, painting material, etc.",Waste,Bulky waste,Construction and demolition waste,
1044,Building materials have been here for 2 weeks and nothing is being done with them,Waste,Bulky waste,Construction and demolition waste,
1045,illegal. construction and demolition waste. (bathroom),Waste,Bulky waste,Construction and demolition waste,
1046,"Via BB: ""Deposited debris""",Waste,Bulky waste,Construction and demolition waste,
1047,Someone has been kind enough to dump construction waste in the parking lot at the Uithof,Waste,Bulky waste,Construction and demolition waste,
1048,debris bag next to orac,Waste,Bulky waste,Construction and demolition waste,
1049,the location Nunspeetlaan corner Terletstraat at house number 420 an illegal bulky waste placement has been detected. This concerns a sofa and wooden planks. ,Waste,Bulky waste,Construction and demolition waste,
1050,Thick glass and other construction and demolition waste. Also includes cupboards.,Waste,Bulky waste,Construction and demolition waste,
1051,There is a toilet bowl next to the orac. ,Waste,Bulky waste,Construction and demolition waste,
1052,n> wehlstraat bulky waste,Waste,Bulky waste,Construction and demolition waste,
1053,roofing parking lot de uithof,Waste,Bulky waste,Construction and demolition waste,
1054,"Mr. contacted us to indicate that a table tennis has been dumped in the Lichtenbergstraat and 10 meters further Mr. indicates that there is a place where a tree will be placed, but construction and demolition waste has been deposited there. ",Waste,Bulky waste,Construction and demolition waste,
1055,"There is a lot of bulky waste on the street. More and more is added. A radiator has now also been added. there is everything, toys, wood, waste bins etc.",Waste,Bulky waste,Construction and demolition waste,
1056,Illegal construction waste has been dumped at lamppost 55,Waste,Bulky waste,Construction and demolition waste,
1057,There is a toilet bowl next to the orac.,Waste,Bulky waste,Construction and demolition waste,
1058,bag with construction waste,Waste,Bulky waste,Construction and demolition waste,
1059,nav MOR2299486: the 2 large white bags of sand are still there. Mr. received a message from the department that nothing is there. But that's not right. Can you remove this asap please,Waste,Bulky waste,Construction and demolition waste,
1060,There are 2 garbage bags with sand. This was dumped by someone who put it there by car. Can this be picked up please?,Waste,Bulky waste,Construction and demolition waste,
1061,Pallets dumped. Fire hazard,Waste,Bulky waste,Construction and demolition waste,
1062,"Unauthorized bulky waste, start of the street, crossing Hengelolaan 2 toilet bowls and a tavel model refrigerator",Waste,Bulky waste,Construction and demolition waste,
1063,See photo ..... litter / construction waste,Waste,Bulky waste,Construction and demolition waste,
1064,2 PVC pipes of about 5 meters along the ditch side in the grass. Please take it with you,Waste,Bulky waste,Construction and demolition waste,
1065,Crap from giesbers for 8 months. Already asked to clean up but not heeded,Waste,Bulky waste,Construction and demolition waste,
1066,Two toilet bowls with container 0285,Waste,Bulky waste,Construction and demolition waste,
1067,Kitchen door made of plastic with double glazing,Waste,Bulky waste,Construction and demolition waste,
1068,Mister calls because he had an appointment for bulky waste today and the neighbors also added demolition waste. He wants to pass this on because he does not want to receive a fine later,Waste,Bulky waste,Construction and demolition waste,
1069,There has been a cement container for a while where waste is put in and where cloudy water remains and starts to smell,Waste,Bulky waste,Construction and demolition waste,
1070,Placement of a toilet bowl next to 18 RB0414,Waste,Bulky waste,Construction and demolition waste,
1071,Garden tiles at the ditch side,Waste,Bulky waste,Construction and demolition waste,
1072,The reporter indicates that various items have been dumped on the street. Please delete,Waste,Bulky waste,Construction and demolition waste,
1073,"It concerns construction waste that has been there for a few weeks (see photo). Lies among the greenery near a gray probably electricity box. The reporter indicates that he has already reported this, but is still standing.",Waste,Bulky waste,Construction and demolition waste,
1074,Car tires on the street,Waste,Bulky waste,Construction and demolition waste,
1075,"There have been paving stones in the grass here for some time now. Grass has already been mowed regularly, but the tiles are simply passed over. The youth has already thrown a few tiles. It would be nice if they were removed. Mvg Yvonne",Waste,Bulky waste,Construction and demolition waste,
1076,"Mrs. reports that quite a lot of sand (about 1.5 meters high) has been left by the contractor. This is related to the installation of fiber optic cable, whereby the street has been broken open. The mountains of sand is still there. This ended up there because KPN installed fiber in the street. They dumped the remaining sand. It is spread all over the street, the worst situation being at the bridge. Bridge is located on the corner of Beilenstraat / Zuidlarenstraat.",Waste,Bulky waste,Construction and demolition waste,
1077,"construction demolition waste stone pallet, debris.",Waste,Bulky waste,Construction and demolition waste,
1078,There is construction waste here.,Waste,Bulky waste,Construction and demolition waste,
1079,Ms indicates that a washbasin was installed 14 days ago and is still there today. The sink is misrepresented next to the orac's which are closed. ,Waste,Bulky waste,Construction and demolition waste,
1080,The stones have been around for a long time and there is a good chance that an adult or child will trip and fall.,Waste,Bulky waste,Construction and demolition waste,
1081,"We find this just in front of our house. This makes our home very sensitive to burglary! climbing over the wall is therefore very easy, so we are really not happy with this! Can action be taken on this as soon as possible? In any case, it is also partly in front of the exit of our back entrance through the garden!",Waste,Bulky waste,Construction and demolition waste,
1082,There is a bucket of concrete in front of the flat. Can this be removed.,Waste,Bulky waste,Construction and demolition waste,
1083,Mr. calls to inform us that a contractor is grinding construction tile at Jan Luykenlaan 189 every day (including Saturdays and Sundays) and then places it next to the orac ,Waste,Bulky waste,Construction and demolition waste,
1084,bulky waste on the street,Waste,Bulky waste,Construction and demolition waste,
1085,Kuinrestraat corner of Maartensdijklaan are 28 discarded pavement tiles near lamppost,Waste,Bulky waste,Construction and demolition waste,
1086,"toilet bowl, container and broken bicycle have been here for over a week. Location is a Post-nl depot. We are getting a bit sick of this view",Waste,Bulky waste,Construction and demolition waste,
1087,Construction and demolition waste has been lying around for several weeks,Waste,Bulky waste,Construction and demolition waste,
1088,washbasin has been outside by the tree since Sunday 6 Dec.,Waste,Bulky waste,Construction and demolition waste,
1089,Mr. wants to report a washbasin on the public road. Please delete.,Waste,Bulky waste,Construction and demolition waste,
1090,"in recent months, construction workers have worked in the p langendijkstr and have now left a lot of wood behind. local residents also add a lot",Waste,Bulky waste,Construction and demolition waste,
1091,There are pieces of floor tiles near a tree.,Waste,Bulky waste,Construction and demolition waste,
1092,"KPN lays cables in the street and illegally deposits mountains of sand near the bushes near a bridge. This concerns large quantities of sand that is dumped there, instead of being removed.",Waste,Bulky waste,Construction and demolition waste,
1093,The reporter indicates that debris is being dumped in the container and construction and demolition waste is also being put next to it. Please remove asap.,Waste,Bulky waste,Construction and demolition waste,
1094,Car tires and a jerry can have been there for weeks,Waste,Bulky waste,Construction and demolition waste,
1095,Toilet bowl at orac crossing velpsestraat / kootwijstraat,Waste,Bulky waste,Construction and demolition waste,
1096,Construction waste found on Hengelolaan at house numbers 67-83,Waste,Bulky waste,Construction and demolition waste,
1097,large stone tiles dumped,Waste,Bulky waste,Construction and demolition waste,
1098,construction demolition waste has been dumped on the Veenendaalkade near house number 338. It concerns 2 washbasins.,Waste,Bulky waste,Construction and demolition waste,
1099,Concerns construction / demolition waste,Waste,Bulky waste,Construction and demolition waste,
1100,Have been tiles on the sidewalk for a week.,Waste,Bulky waste,Construction and demolition waste,
1101,"On the corner of Dedemsvaartweg and Oosterhesselenstraat, there is construction waste, cans of paint and stone near the orac's",Waste,Bulky waste,Construction and demolition waste,
1102,"Ms. has engaged a company that has installed window frames in her home. These are supplied on a large metal rack. The work is finished, but the rack is still there. Ms. has been in contact with the company, but they are in no hurry to pick it up. Her neighbors complain to mrs because the rack is taking up parking spaces. They are also dangerous. Can the rack be removed?",Waste,Bulky waste,Construction and demolition waste,
1103,large glass plates Mrs. indicates that the neighbors of house number 46 have been there for 3 days and happened more often,Waste,Bulky waste,Construction and demolition waste,
1104,"There is construction waste next to the road, so people throw it on the cars. This construction waste is left behind by the contractor. Construction waste such as tiles and glass lies along the road. Can be maintained on this.",Waste,Bulky waste,Construction and demolition waste,
1105,construction and demolition waste next to the collection container.,Waste,Bulky waste,Construction and demolition waste,
1106,There are dumped plates on the sidewalk,Waste,Bulky waste,Construction and demolition waste,
1107,15 cubic meters illegally dumped according to HH,Waste,Bulky waste,Construction and demolition waste,
1108,"In front of the door of Tomatenlaan 14 A, blocks of granite have been illegally laid on the sidewalk, please maintain and remove these blocks",Waste,Bulky waste,Construction and demolition waste,
1109,Lots of stones on the road. Can this be removed?,Waste,Bulky waste,Construction and demolition waste,
1110,Mrs. reports a project that has been halted for 3.5 weeks. There is a large waste container on the sidewalk with stones. The sidewalk around the oracs is also not finished yet. What is going to happen now? Residents have to go through the sand to offer their waste.,Waste,Bulky waste,Construction and demolition waste,
1111,"Since New Year's Eve there has been a palst en ton on the sidewalk that causes dangerous situations. Please have it removed. Thank you very much in advance, M. yakoubi",Waste,Bulky waste,Construction and demolition waste,
1112,"Rubble / construction and demolition waste has been dumped in ORACs, everything is under the rubble and cement now. Please remove and maintain more often.",Waste,Bulky waste,Construction and demolition waste,
1113,"Mr. indicates that building plates have been placed on the lawn, no work can be found. It has also happened in the past when enforcement wanted to take a picture, which Mr. Can you see if this is allowed, and enforce it.",Waste,Bulky waste,Construction and demolition waste,
1114,In the green there is bulky waste and construction and demolition waste. ,Waste,Bulky waste,Construction and demolition waste,
1115,There is a sink that is broken.,Waste,Bulky waste,Construction and demolition waste,
1116,"oil tank, car tires, laminate couch, etc.",Waste,Bulky waste,Construction and demolition waste,
1117,Construction and demolition waste among the bushes (white stones) has been reported before: mor2255239,Waste,Bulky waste,Construction and demolition waste,
1118,"The Fred van Rijn company, for renovating your house, painting and wallpapering, throws its waste in the normal containers when they are at customers. They do not take it with them, but throw it in the regular waste with all the consequences that entails Roller shutters etc. are also thrown in the waste containers.",Waste,Bulky waste,Construction and demolition waste,
1119,Mister calls for a problem he has been in contact with before. He indicates that the residents of the houseboat in his street have been leaving pieces of wood on the quay for several months. This is not good for the street scene and is not tidy. Please look it up so that it can be removed. ,Waste,Bulky waste,Construction and demolition waste,
1120,"There are 4 wooden planks against a tree, they have been there for over 2 weeks. Please delete.",Waste,Bulky waste,Construction and demolition waste,
1121,Pallets placed next to the container,Waste,Bulky waste,Construction and demolition waste,
1122,There is a palette against a tree at Albertheijn,Waste,Bulky waste,Construction and demolition waste,
1123,There are 2 radio towers on the sidewalk,Waste,Bulky waste,Construction and demolition waste,
1124,"Construction and demolition waste street. blocks, toilet.",Waste,Bulky waste,Construction and demolition waste,
1125,"Plasterboard, old plumbing, gas blocks thrown on the street by the people who are renovating. Had made an appointment for bulky waste, but of course this was not included because construction and demolition waste. Bulky waste did ring the bell, but of course they did not open the door.",Waste,Bulky waste,Construction and demolition waste,
1126,Build rubbish between the bushes (white stones),Waste,Bulky waste,Construction and demolition waste,
1127,Build rubbish (bricks) on the sidewalk.,Waste,Bulky waste,Construction and demolition waste,
1128,Bathtub old fridge etc Left in the bushes ,Waste,Bulky waste,Construction and demolition waste,
1129,Just like on Guntersteinweg 14 rubble lies in the border / street,Waste,Bulky waste,Construction and demolition waste,
1130,uithof parking lot along the bossage zonnenoord at house numbers 25 / 77. on high moor 132/148,Waste,Bulky waste,Construction and demolition waste,
1131,There is a pipe of a zone wall near the hedge opposite orac that can be removed,Waste,Bulky waste,Construction and demolition waste,
1132,There are three white bags with plaster plates in plaster by the tree,Waste,Bulky waste,Construction and demolition waste,
1133,"plaster, tiles at an underground container",Waste,Bulky waste,Construction and demolition waste,
1134,Toilet bowl in grass and glass,Waste,Bulky waste,Construction and demolition waste,
1135,"Mr. indicates that there is a large concrete in the street, there were just waste employees who looked at it and left it there, Mr. indicates. The gentleman indicates that he has already reported this on Monday.",Waste,Bulky waste,Construction and demolition waste,
1136,Construction waste was placed at the ORAC,Waste,Bulky waste,Construction and demolition waste,
1137,"via chat: sir indicates that a few weeks ago a report was made of a construction disaster. The container that stood here has now been removed, the construction waste is still there. Can this be taken down? It winds through the street",Waste,Bulky waste,Construction and demolition waste,
1138,"there is all construction and demolition waste, iron and stones, wood, concrete, rubber, these people have cleaned up their garden and left everything behind.",Waste,Bulky waste,Construction and demolition waste,
1139,Debris has been dumped at orac,Waste,Bulky waste,Construction and demolition waste,
1140,"Mrs. had a bulky waste appointment, people have added 2 sinks and these were of course not taken. Can this still be removed?",Waste,Bulky waste,Construction and demolition waste,
1141,There is construction and demolition waste ,Waste,Bulky waste,Construction and demolition waste,
1142,"Reporting of construction waste that is in the public space, such as tiles and pipes, these have been open and exposed for three weeks. These are from neighbors who have grown their garden.",Waste,Bulky waste,Construction and demolition waste,
1143,Toilet left by tree. Please bring these with you. Has been there for months,Waste,Bulky waste,Construction and demolition waste,
1144,like to clean up buckets next to a container and bulky waste in the street,Waste,Bulky waste,Construction and demolition waste,
1145,"Fully loaded construction container has been standing in front of my neighbor's window for more than 4 weeks, it may be pointed out by now",Waste,Bulky waste,Construction and demolition waste,
1146,Garden demolition waste is a kind of concrete block in the bushes. ,Waste,Bulky waste,Construction and demolition waste,
1147,"Public street construction waste is gypsum blocks / bricks. Side street of the Lozerlaan in an alley all the way to the back at the end stop of the tram depot at the UIthof near the parking lot, in that alley at the back towards the riding school / bird club there are a lot of plaster blocks / stones. (accessible to traffic).",Waste,Bulky waste,Construction and demolition waste,
1148,Dumped from a van.,Waste,Bulky waste,Construction and demolition waste,
1149,Refurbishment waste at the oracs. Please take it with you,Waste,Bulky waste,Construction and demolition waste,
1150,Illegally dumped bitumen roofing by someone who wanted to hand in old zinc on his bicycle,Waste,Bulky waste,Construction and demolition waste,
1151,"There are garden tiles, there are old branches, there has been an old plant for months, it is a big mess",Waste,Bulky waste,Construction and demolition waste,
1152,Garden demolition waste is a kind of concrete block in the bushes. it protrudes 10 cm. Garden demolition waste is a kind of concrete block in the bushes,Waste,Bulky waste,Construction and demolition waste,
1153,pallet and sewage pipes,Waste,Bulky waste,Construction and demolition waste,
1154,"At the intersection Copenhagenweg and Athenesingel, T intersection. 3/4 corrugated iron left behind, suspected of asbestos.",Waste,Bulky waste,Construction and demolition waste,
1155,Mrs. reports a toilet bowl next to the collection container. Please delete,Waste,Bulky waste,Construction and demolition waste,
