,Description,Category,SubCategory1,SubCategory2,SubCategory3
486,THV number 22 is a parking box for a scooter and the Christmas tree is next to it.,Waste,Pollution New Year,Christmas trees,
487,"Mlder indicates that the Christmas trees would be picked up on 7-01, however, this did not happen",Waste,Pollution New Year,Christmas trees,
488,"The Christmas trees have not been displayed in the entire De Lanen district, despite the garbage calendar.",Waste,Pollution New Year,Christmas trees,
489,"The Christmas trees were NOT picked up at e Buitentuine last Monday, please pick them up after all.",Waste,Pollution New Year,Christmas trees,
490,the Christmas trees on the Vondelstraat were not picked up yesterday (7 years),Waste,Pollution New Year,Christmas trees,
491,The Christmas trees were not collected in the Rijstkamp.,Waste,Pollution New Year,Christmas trees,
492,The Christmas trees were not collected in the Willen van Nieuwenhuizenlaan. Can these still be picked up asap.,Waste,Pollution New Year,Christmas trees,
493,"On Monday the Christmas trees were picked up, in the street there is another Christmas tree, which was not taken.",Waste,Pollution New Year,Christmas trees,
494,There are many burnt Christmas trees next to the playground on the Schimmelweg,Waste,Pollution New Year,Christmas trees,
495,"Opposite the building of No. 31 on the Koperwerf, bulky litter and a Christmas tree have been dumped on the sidewalk.",Waste,Pollution New Year,Christmas trees,
496,Christmas tree on the sidewalk in the Prinsestraat.,Waste,Pollution New Year,Christmas trees,
497,Wooden bed and slatted base and Christmas tree.,Waste,Pollution New Year,Christmas trees,
498,Christmas tree on the street. ,Waste,Pollution New Year,Christmas trees,
499,"Christmas trees have been lying near the flat since yesterday, have not been collected. Christmas trees were already set on fire yesterday.",Waste,Pollution New Year,Christmas trees,
500,NEAR the orac are several Christmas trees,Waste,Pollution New Year,Christmas trees,
501,"There are several Christmas trees at all underground containers around the square on the Melis Stoke side, also in the bushes. Fire hazard given all incidents in the city.",Waste,Pollution New Year,Christmas trees,
502,"Yesterday was the collection day for Christmas trees, these were not collected. Please pick it up. It concerns 3 trees.",Waste,Pollution New Year,Christmas trees,
503,This concerns a whole pile of trees that have not been taken in 2 collection moments,Waste,Pollution New Year,Christmas trees,
504,Against the facade opposite number 21 there are a number of Christmas trees that have not been collected. ,Waste,Pollution New Year,Christmas trees,
505,Today (06-01) the Christmas trees were not picked up at Moerbeiplein. ,Waste,Pollution New Year,Christmas trees,
506,"Madam has offered her Christmas tree for today, it has not been collected.",Waste,Pollution New Year,Christmas trees,
507,They forgot to bring 2 Christmas trees on Weimarstraat. THV 405,Waste,Pollution New Year,Christmas trees,
508,"Madam presented her Christmas tree today, it was not collected.",Waste,Pollution New Year,Christmas trees,
509,The reporter indicates that today was the collection day for the Christmas trees. Mrs. Christmas tree has not been collected,Waste,Pollution New Year,Christmas trees,
510,"Today and last week the Christmas trees would be picked up in Edisonstraat, none of the days have been, sir is afraid that the Christmas trees will be set on fire if they are not picked up. ",Waste,Pollution New Year,Christmas trees,
511,"In the Heiloostraat, on the corner of the Escamplaan, there are many Christmas trees together. At the flat.",Waste,Pollution New Year,Christmas trees,
512,there are still many Christmas trees on the Melis Stokke side. Please pick up. Today is the collection day. Maybe they will be picked up because of this report.,Waste,Pollution New Year,Christmas trees,
513,"The Christmas trees in the Wormerveerstraat were supposed to be picked up, this did not happen. ",Waste,Pollution New Year,Christmas trees,
514,Christmas tree in the ditch,Waste,Pollution New Year,Christmas trees,
515,"Yesterday, Madam presented her Christmas tree correctly, it was not collected.",Waste,Pollution New Year,Christmas trees,
516,Christmas tree on the sidewalk opposite No. 8,Waste,Pollution New Year,Christmas trees,
517,"Yesterday the Christmas trees were supposed to be picked up in the Hanenburglaan, Madam's is still there.",Waste,Pollution New Year,Christmas trees,
518,"In the van der Parrastraat, there are about 30 Christmas trees that must be picked up asap. The whole sidewalk is no longer accessible.",Waste,Pollution New Year,Christmas trees,
519,"The Christmas tree has not yet been picked up here, was supposed to happen on Friday and the lady thinks they have forgotten her.",Waste,Pollution New Year,Christmas trees,
520,"Christmas trees were not removed yesterday, they are now in the street and in the flowerbeds",Waste,Pollution New Year,Christmas trees,
521,Christmas trees on the street.,Waste,Pollution New Year,Christmas trees,
522,"it is still completely full of Christmas trees here, madam is afraid of fire because an orac caught fire yesterday. Christmas trees are diagonally against a house, and if they catch fire it can get very out of hand.",Waste,Pollution New Year,Christmas trees,
523,Christmas trees all over the street not picked up on the scheduled pick up day. Please pick it up.,Waste,Pollution New Year,Christmas trees,
524,Christmas trees not collected,Waste,Pollution New Year,Christmas trees,
525,"Madam is now calling for the 2nd time to report Christmas trees blocking the entrance to a scooter shed. Yesterday Ms was promised that this would be cleaned up yesterday, but that did not happen. Please check and clean up as soon as possible, because several local residents cannot access their scooter now. (MOR1955052)",Waste,Pollution New Year,Christmas trees,
526,"The Christmas trees are in front of the garden door of Riouwstraat 154. That garden door is in the Lombokstraat, not a house number, at the oracs. The Lombok Street is so short that it cannot be missed.",Waste,Pollution New Year,Christmas trees,
527,Christmas trees next to Orac.,Waste,Pollution New Year,Christmas trees,
528,"Christmas tree was not picked up yesterday, is still on the street",Waste,Pollution New Year,Christmas trees,
529,There is a Christmas tree here.,Waste,Pollution New Year,Christmas trees,
530,There are Christmas trees here.,Waste,Pollution New Year,Christmas trees,
531,"Last week and yesterday, the Christmas trees were not collected from the gentleman in the street, but this was planned in the garbage calendar. Not even in the streets around it. Sir fears fire hazard. Please delete. ",Waste,Pollution New Year,Christmas trees,
532,"Christmas trees have also been trees for almost 5 days, unfortunately",Waste,Pollution New Year,Christmas trees,
533,"Good evening I just looked through the window and to my great surprise I saw a Christmas tree in the jasmine street near house number 82. I would like the enforcement to take the time to deal with my report and possibly issue a fine for this violation. I would also like to have telephone contact with law enforcement because it is becoming more and more with all that junk on the street. Thanks in advance,",Waste,Pollution New Year,Christmas trees,
534,Christmas tree next to Orac,Waste,Pollution New Year,Christmas trees,
535,Various Christmas trees at ORACS. Fire hazard.,Waste,Pollution New Year,Christmas trees,
536,"several Christmas trees near the underground containers, also in the bushes. Fire hazard given all incidents in the city.",Waste,Pollution New Year,Christmas trees,
537,Lots of Christmas trees are blocking the way!,Waste,Pollution New Year,Christmas trees,
538,about 10 trees that have been burned.,Waste,Pollution New Year,Christmas trees,
539,The reporter indicates that Christmas trees have been placed in front of the scooter hutch. Please delete,Waste,Pollution New Year,Christmas trees,
540,Thrown about 10 Christmas trees in the schoolyard,Waste,Pollution New Year,Christmas trees,
541,"Good morning, today the Christmas trees are picked up in the Beukstraat. Now neighboring children have dragged a large pile of trees on the Beukplein. That is difficult to see from the street. Can you point this out to those who collect the trees today so that the trees do not remain?",Waste,Pollution New Year,Christmas trees,
542,"The Christmas trees were supposed to be picked up in Madurolaan on January 3, this did not happen. ",Waste,Pollution New Year,Christmas trees,
543,"There is another Christmas tree on the street. This has not been collected. Can it be picked up for the time being, please?",Waste,Pollution New Year,Christmas trees,
544,"Mr. indicates that the Christmas tree will not be picked up on the collection day. Mr. indicates that he himself lives in a courtyard and this time will place the Christmas tree at the back of the house with address Schelfhoutstraat 16, 2526XP The Hague. Please pick up asap due to fire hazard.",Waste,Pollution New Year,Christmas trees,
545,Ms indicates that the Christmas trees would be picked up on 02-01. Now the Christmas tree is still there. Can this be picked up urgently please?,Waste,Pollution New Year,Christmas trees,
546,"Christmas tree on the sidewalk, with the wind it blows across the street",Waste,Pollution New Year,Christmas trees,
547,Christmas trees at orac,Waste,Pollution New Year,Christmas trees,
548,"In the Thorbeckelaan at 336 H are six Christmas trees, which should be picked up yesterday, this has not been done. Could these trees be removed asap.",Waste,Pollution New Year,Christmas trees,
549,"Thursday 02-01 the Christmas trees in the neighborhood would be picked up. That also happened, but not in the Aaltje Noordewierstraat. Next Monday is another collection day, but mrs is afraid that it will not be collected, just like in previous years. There are now a lot of them in the street, please make sure that they are removed asap.",Waste,Pollution New Year,Christmas trees,
550,The Christmas trees were not picked up in the street yesterday. This was planned.,Waste,Pollution New Year,Christmas trees,
551,"Madam indicates that a car just drove past for Christmas trees, but has not taken any trees.",Waste,Pollution New Year,Christmas trees,
552,Christmas tree at orac,Waste,Pollution New Year,Christmas trees,
553,This Christmas tree has been roaming the neighborhood around the containers for a few weeks ...,Waste,Pollution New Year,Christmas trees,
554,Christmas tree next to 16RB0119. ,Waste,Pollution New Year,Christmas trees,
555,"Christmas is over, I think. Christmas tree on the street.",Waste,Pollution New Year,Christmas trees,
556,There have been 2 Christmas trees in the green on the corner of Pieter Spastraat for quite some time. Please delete.,Waste,Pollution New Year,Christmas trees,
557,Christmas trees have not been collected. Can this still be done?,Waste,Pollution New Year,Christmas trees,
558,Christmas trees have been on the sidewalk for 1 week,Waste,Pollution New Year,Christmas trees,
559,Christmas tree has been on the street for days. ,Waste,Pollution New Year,Christmas trees,
560,There are 5 Christmas trees on a neighborhood playground.,Waste,Pollution New Year,Christmas trees,
561,A large Christmas tree has been standing at the address 2548 RV since the beginning of January.,Waste,Pollution New Year,Christmas trees,
562,Reporter indicates that there have been Christmas trees throughout the neighborhood for three weeks. at sir at the door there are already 3 and indicates that these are large Christmas trees.,Waste,Pollution New Year,Christmas trees,
563,there is a Christmas tree,Waste,Pollution New Year,Christmas trees,
564,The reporter indicates that a Christmas trees have been lying next to the ORAC since 13 January and are now blowing into the street. there are 2,Waste,Pollution New Year,Christmas trees,
565,2 Christmas trees have not been taken for a few weeks by the car of the municipality cleaning that is emptying the green boxes in our street. The trees take up much of the sidewalk.,Waste,Pollution New Year,Christmas trees,
566,Christmas tree is here from the beginning of January,Waste,Pollution New Year,Christmas trees,
567,There is still a Christmas tree lying around on the sidewalk by the tree.,Waste,Pollution New Year,Christmas trees,
568,Christmas trees on playground,Waste,Pollution New Year,Christmas trees,
569,"There is a Christmas tree and bulky waste near the underground containers, this has been here for a while cannot be removed bvd",Waste,Pollution New Year,Christmas trees,
570,Christmas tree next to collection container.,Waste,Pollution New Year,Christmas trees,
571,Description 2 Christmas trees left on the sidewalk,Waste,Pollution New Year,Christmas trees,
572,It is a Christmas tree that has been there for at least a week at the height of the ORACs next to a tree (see photo). Please remove as soon as possible due to deterioration and possible arson.,Waste,Pollution New Year,Christmas trees,
573,there is a Christmas tree on the sidewalk,Waste,Pollution New Year,Christmas trees,
574,There is a pile of Christmas trees in Hoefbladlaan at number 28. Can this be removed? A report was also made on 21-1-2020 and it was not picked up. Previous entry: MOR1970452 ,Waste,Pollution New Year,Christmas trees,
575,Christmas tree is still there! ,Waste,Pollution New Year,Christmas trees,
576,there are 2 Christmas trees near the oracs ,Waste,Pollution New Year,Christmas trees,
577,Placement of a Christmas tree next to container OR 18RB0475,Waste,Pollution New Year,Christmas trees,
578,there is a Christmas tree near the oracs ,Waste,Pollution New Year,Christmas trees,
579,"A Christmas tree (MOR1967026) that was not collected was reported on 17-01, it was transferred to HMS by environmental management Haagse Hout. The Christmas tree is still there. Please remove at the transformer house diagonally on the other side of Van Trigtstraat 57.",Waste,Pollution New Year,Christmas trees,
580,"By not picking up the Christmas trees in time, after the first report, they have now been partially set on fire, between 2 houses. This is already the second report .... I expect this to be resolved before the weekend. 😡😡",Waste,Pollution New Year,Christmas trees,
581,"My Christmas tree was not picked up while it was outside well in time .. other trees that were next to it, a few at first and the other now a week later too. So all except 1. I think this is very strange. I would like the tree to be picked up. Source: contact form 22-01-2020 21:05.",Waste,Pollution New Year,Christmas trees,
582,"The detector indicates that there is a Christmas tree, please remove it",Waste,Pollution New Year,Christmas trees,
583,A Christmas tree has been placed between the ORACs.,Waste,Pollution New Year,Christmas trees,
584,"There are still Christmas trees here and there on the Valkenboskade, could they still be picked up?",Waste,Pollution New Year,Christmas trees,
585,Mrs. indicates that there are all kinds of Christmas trees and newspapers in a hole near the skateboard park. Mrs. requests to remove this asap. It has been there since the turn of the year.,Waste,Pollution New Year,Christmas trees,
586,"This Christmas tree has been here for a while, can it be removed?",Waste,Pollution New Year,Christmas trees,
587,"There is a Christmas tree in the field, please pick it up.",Waste,Pollution New Year,Christmas trees,
588,"On January 15, a report was made that a Christmas tree was not picked up at 108 Van Der Aastraat. The report has been canceled, but the Christmas tree is still there .. Can this tree be picked up asap? 2597SN 108. ",Waste,Pollution New Year,Christmas trees,
589,Christmas tree dumped next to lamppost.,Waste,Pollution New Year,Christmas trees,
590,Reporter indicates that there has been a Christmas tree on the street with a cloth around it for about 11 days. The wind has also hit cars a few times. Please delete,Waste,Pollution New Year,Christmas trees,
591,Christmas tree placed at the ORACs.,Waste,Pollution New Year,Christmas trees,
592,there are 6 Christmas trees at the oracs ,Waste,Pollution New Year,Christmas trees,
593,"Previously made a report (MOR1964233) of Christmas trees that have not been collected, but it has been registered incorrectly. Can this still be picked up urgently? The whole street is still full of Christmas trees.",Waste,Pollution New Year,Christmas trees,
594,There have been 6 Christmas trees next to his house for 2 weeks,Waste,Pollution New Year,Christmas trees,
595,next to the oracs there is a Christmas tree.,Waste,Pollution New Year,Christmas trees,
596,Christmas tree was not collected according to schedule on 13-01-20,Waste,Pollution New Year,Christmas trees,
597,Christmas tree was not collected in accordance with the municipality's pick-up schedule of 13-01-20.,Waste,Pollution New Year,Christmas trees,
598,Christmas tree square at the red village / hoof quay,Waste,Pollution New Year,Christmas trees,
599,Christmas tree has not been collected. (MOR1963538),Waste,Pollution New Year,Christmas trees,
600,There has been a Christmas tree here for a while. Please pick up.,Waste,Pollution New Year,Christmas trees,
601,Is a Christmas tree near the oracs,Waste,Pollution New Year,Christmas trees,
602,Very large Christmas tree is still on the street,Waste,Pollution New Year,Christmas trees,
603,"Christmas trees are still on the street, several reports have already been made. MOR1965846 ",Waste,Pollution New Year,Christmas trees,
604,multiple Christmas trees not retrieved / deleted message via social media,Waste,Pollution New Year,Christmas trees,
605,1 x Christmas tree on the roundabout,Waste,Pollution New Year,Christmas trees,
606,The gentleman has recently reported his Christmas tree that has not been collected. The report is completed but the Christmas tree is unfortunately still there. Please delete. MOR1963355,Waste,Pollution New Year,Christmas trees,
607,In the Juliana van Stolberglaan a Christmas tree of 3 meters is located next to and sometimes (due to the wind) on a disabled parking space.,Waste,Pollution New Year,Christmas trees,
608,"It is a Christmas tree, see photo)",Waste,Pollution New Year,Christmas trees,
609,Christmas trees next to oracs,Waste,Pollution New Year,Christmas trees,
610,There are a number of Christmas trees (4 pieces) and another 2.,Waste,Pollution New Year,Christmas trees,
611,"There is a Christmas tree here, 2 meters long and 1.5 meters in diameter, which has been thrown on the sidewalk. Nobody can pass it and there are many elderly people here with mobility scooters and walkers who then have to take a bit of the road to get around it.",Waste,Pollution New Year,Christmas trees,
612,"Christmas tree next to orac, but not taken.",Waste,Pollution New Year,Christmas trees,
613,Mrs. indicates that there are a lot of Christmas trees that have not yet been collected. Can this be cleaned up urgently please? It was supposed to be picked up on Monday.,Waste,Pollution New Year,Christmas trees,
614,"On the left, diagonally opposite number 35, there is a Christmas tree that has not yet been collected.",Waste,Pollution New Year,Christmas trees,
615,A pile of Christmas trees has been in the Morsestraat since 6 January. Can these be removed asap.,Waste,Pollution New Year,Christmas trees,
616,"In the Waterbiesweg of number 36, no collection was made three times. The Christmas tree is just outside the door on the sidewalk along the road. It may be that there are cars in front.",Waste,Pollution New Year,Christmas trees,
617,several Christmas trees on a hop,Waste,Pollution New Year,Christmas trees,
618,There is a Christmas tree on the grass behind the fence,Waste,Pollution New Year,Christmas trees,
619,Christmas tree and div. Besides the orac,Waste,Pollution New Year,Christmas trees,
620,"After the pick-up, still 3 Christmas trees in the square. Overlooked...",Waste,Pollution New Year,Christmas trees,
621,Ms has made a report on 07-01-2020 (MOR1956370) it concerns her Christmas tree that has not been collected to date.,Waste,Pollution New Year,Christmas trees,
622,2 Jan 6 Jan 13 Jan were the collection days for the Christmas trees. There are still Christmas trees in the staraat even after previous reports. Please pick up. The Christmas trees are now blowing in all directions due to strong winds!,Waste,Pollution New Year,Christmas trees,
623,"Christmas trees have not yet been picked up, are already on the street from last week",Waste,Pollution New Year,Christmas trees,
624,"Christmas trees have not been collected, it has been previously reported with MOR1958050 is all over the street",Waste,Pollution New Year,Christmas trees,
625,Various Christmas trees on public roads,Waste,Pollution New Year,Christmas trees,
626,Yesterday (January 14) the Christmas trees should be picked up but they are still on the street. Please remove asap,Waste,Pollution New Year,Christmas trees,
627,Christmas tree stump next to Orac,Waste,Pollution New Year,Christmas trees,
628,"Mrs. calls to inform us that there are more than 3 Christmas trees in Fultonstraat. At house number 117, across it and a few houses further",Waste,Pollution New Year,Christmas trees,
629,"Mrs. indicates that she had put her Christmas tree outside because it was to be picked up, but this did not happen, she presented it neatly for the day it was taken away.",Waste,Pollution New Year,Christmas trees,
630,"It concerns several Christmas trees in the street, these have still not been collected. Please pick it up.",Waste,Pollution New Year,Christmas trees,
631,"they did not drop by on the collection days for the Christmas trees at the address below. Due to the strong wind, the Christmas trees are going in all directions. Creates dangerous situations. Please pick up if still available.",Waste,Pollution New Year,Christmas trees,
632,"The gentleman offered his Christmas tree for collection as indicated on the garbage calendar. However, it has not yet been collected. The request to take him.",Waste,Pollution New Year,Christmas trees,
633,Christmas tree offered a day too early !!,Waste,Pollution New Year,Christmas trees,
634,"Madam indicates that she has offered her Christmas tree on the agreed day, it has not been taken, she has now placed it in the tree mirror of one of the trees. Can it be picked up?",Waste,Pollution New Year,Christmas trees,
635,Christmas tree on the street.,Waste,Pollution New Year,Christmas trees,
636,Again Christmas trees not collected! Not last Monday either. Why is our street always skipped.,Waste,Pollution New Year,Christmas trees,
637,Christmas trees next to oracs behind hubo,Waste,Pollution New Year,Christmas trees,
638,There has been a large Christmas tree on the Anna van Buerenplein at the entrance of the Q-park garage all week. Can you pick it up?,Waste,Pollution New Year,Christmas trees,
639,"Ms indicates that there have been Christmas trees in the street for 2 weeks. In the household waste calendar, it was scheduled for Tuesday. It's still there. Please delete.",Waste,Pollution New Year,Christmas trees,
640,"There has already been mention of an uncollected Christmas tree, another one has now been added. Please pick up asap.",Waste,Pollution New Year,Christmas trees,
641,There is another Christmas tree here next to the oracs that has not been collected with the standard pick-up days. Now roaming the street.,Waste,Pollution New Year,Christmas trees,
642,It concerns a Christmas tree next to the ORAC there,Waste,Pollution New Year,Christmas trees,
643,"Ms had offered her Christmas tree for the collection day, it has not been collected. Please still pick up. At the tree of the house. Blows in all directions now.",Waste,Pollution New Year,Christmas trees,
644,The Christmas tree was not taken yesterday. please delete it anyway.,Waste,Pollution New Year,Christmas trees,
645,"Mrs. Her Christmas tree is still in front of her door, they have been picked up from her on the corner of the street, but hers were not. ",Waste,Pollution New Year,Christmas trees,
646,Ms. indicates that there is a large Christmas tree on the tram rails. He has been outside for a week but has now ended up on the tram track. Soon he will be on the roadway due to the wind.,Waste,Pollution New Year,Christmas trees,
647,"There is still a Christmas tree here, which has not been collected in the past 2 collection days. Sir wonders why.",Waste,Pollution New Year,Christmas trees,
648,Christmas trees have not yet been collected in the street.,Waste,Pollution New Year,Christmas trees,
649,Christmas tree not picked up today,Waste,Pollution New Year,Christmas trees,
650,in the Zilverreigerstraat at the intersection at number 30/32 about three Christmas trees.,Waste,Pollution New Year,Christmas trees,
651,Christmas tree not collected. ,Waste,Pollution New Year,Christmas trees,
652,"Noordijkstraat near the 2 oracs are 2 Christmas trees, these should have been taken yesterday January 13. Please delete it anyway.",Waste,Pollution New Year,Christmas trees,
653,"The Christmas trees were supposed to be picked up on 13-01, this did not happen. Please pick it up.",Waste,Pollution New Year,Christmas trees,
654,The reporter indicates that there are about 12 Christmas trees on the street,Waste,Pollution New Year,Christmas trees,
655,Madam indicates that the Christmas trees were not collected yesterday. Can these be cleaned up please?,Waste,Pollution New Year,Christmas trees,
656,"The local police officer of Loosduinen indicates that there are about 10 Christmas trees in the football cage, one was already set on fire yesterday. Please remove urgently.",Waste,Pollution New Year,Christmas trees,
